text,meta,extracted_entities
"""FRONT-END DEVELOPER, P&L SYSTEMS Summary Creative and detail-oriented Front-End Developer with 5 years of experience building high-performance web applications for financial P&L and risk reporting systems. Expertise in React, state management (Redux), data visualization (D3.js), and ensuring superior UX in data-intensive portals. Highlights JavaScript, React, Redux P&L & Financial Reporting Systems Data Visualization (D3.js, Highcharts) RESTful API Integration & Performance UX/UI Implementation & Collaboration Agile (Scrum) & Git Experience Front-End Developer, P&L Systems 01/2021 to Current Company Name City , State Led the front-end redesign of the **daily P&L and Risk Attribution reporting portal** using **React and Redux**. Implemented custom, low-latency **data visualization components (D3.js)** for presenting complex trading P&L hierarchies. Optimized application performance, achieving an **80% reduction in data load time** for large tabular reports (10K+ rows). Collaborated closely with Back-End Engineers and Quantitative Analysts to define and integrate RESTful APIs. Ensured compliance with accessibility standards (WCAG) for all new components. Mid-Level Web Developer 06/2018 to 12/2020 Company Name City , State Contributed to the development of the customer account opening web application using Angular. Wrote modular, reusable UI components and ensured cross-browser compatibility. Participated in the migration from jQuery-based legacy code to modern React framework. Education Bachelor of Science : Computer Science 2018 State University Skills Front-End Developer, React, Redux, D3.js, P&L, Financial Reporting, Data Visualization, Trading Systems, Agile, Technology""",{'fullContent': '...'},"{'SKILL': [{'word': '& L S', 'score': 0.6615303158760071}, {'word': 'Front', 'score': 0.9858442544937134}, {'word': 'End Developer', 'score': 0.9183404445648193}, {'word': 'Financial P & L', 'score': 0.9949201345443726}, {'word': 'Risk Reporting', 'score': 0.9034348726272583}, {'word': 'React', 'score': 0.9877408742904663}, {'word': 'State Management', 'score': 0.832253098487854}, {'word': 'Redux', 'score': 0.9495582580566406}, {'word': 'Data Visualization', 'score': 0.9335779547691345}, {'word': 'D3. J', 'score': 0.7946901917457581}, {'word': 'Data', 'score': 0.9563986659049988}, {'word': 'Intensive', 'score': 0.9921228289604187}, {'word': 'Javascript', 'score': 0.8911818265914917}, {'word': 'React', 'score': 0.9353079199790955}, {'word': 'Redux P & L', 'score': 0.8782766461372375}, {'word': 'Financial Reporting Systems Data Visualization', 'score': 0.9930276274681091}, {'word': 'Highcharts', 'score': 0.64470374584198}, {'word': 'Estful API Integration', 'score': 0.8768081665039062}, {'word': 'Performance UX', 'score': 0.9845470786094666}, {'word': 'UI Implementation', 'score': 0.9753513336181641}, {'word': 'Collaboration Agile Scrum', 'score': 0.9504961371421814}, {'word': 'Git Experience Front - End Develo', 'score': 0.8764612078666687}, {'word': 'L Systems', 'score': 0.9140031337738037}, {'word': '& L', 'score': 0.7015997171401978}, {'word': 'Risk Attribution Reporting', 'score': 0.9176075458526611}, {'word': 'React', 'score': 0.6832733750343323}, {'word': 'Redux', 'score': 0.9865736961364746}, {'word': 'Low', 'score': 0.8894245028495789}, {'word': 'Latency Data Visualization', 'score': 0.7184405326843262}, {'word': 'D3. J', 'score': 0.7320103645324707}, {'word': 'Trading P & L Hi', 'score': 0.9598371386528015}, {'word': 'Reports', 'score': 0.5679833292961121}, {'word': 'Back - End Engineers', 'score': 0.900428295135498}, {'word': 'Uant', 'score': 0.9303245544433594}, {'word': 'Itative Analysts', 'score': 0.9617384076118469}, {'word': 'Estful API', 'score': 0.9095765352249146}, {'word': 'Accessibility', 'score': 0.8341084718704224}, {'word': 'Level Web Develo', 'score': 0.7269375324249268}, {'word': 'Customer Account Opening', 'score': 0.6813470721244812}, {'word': 'Ang', 'score': 0.9924894571304321}, {'word': 'Ular', 'score': 0.9122194051742554}, {'word': 'UI Components', 'score': 0.8372898697853088}, {'word': 'React', 'score': 0.942208468914032}, {'word': 'Education', 'score': 0.967282235622406}, {'word': 'Skills Front', 'score': 0.5921557545661926}, {'word': 'End Develo', 'score': 0.9559953808784485}, {'word': 'React', 'score': 0.9394552707672119}, {'word': 'Red', 'score': 0.9851241707801819}, {'word': 'Financial Report', 'score': 0.9801523685455322}, {'word': 'Data Visual', 'score': 0.8955556154251099}, {'word': 'Trading Systems', 'score': 0.8624697923660278}, {'word': 'Technology', 'score': 0.7537292838096619}], 'EXP': [{'word': '5 Years', 'score': 0.9783469438552856}, {'word': 'Load Time', 'score': 0.7199216485023499}, {'word': '10K + Rows', 'score': 0.7476480603218079}]}"
"""INVESTMENT OPERATIONS ASSOCIATE Summary Detail-oriented Investment Operations Associate with 4 years of experience supporting institutional asset management and fund administration. Expertise in trade matching, settlement processing, reconciliation, and NAV calculation for fixed income and equity portfolios. Highlights Trade Matching & Settlement Securities Reconciliation NAV Calculation & Fund Accounting Investment Platforms (Aladdin) Regulatory Compliance (SEC) Experience Investment Operations Associate 06/2021 to Current Company Name City , State Managed the **end-to-end trade matching and settlement process** for institutional Fixed Income and Equity portfolios, resolving daily trade breaks with custodians. Performed **daily Net Asset Value (NAV) reconciliation and calculation** for three proprietary mutual funds, ensuring 100% accuracy. Utilized the **Aladdin platform** for trade entry, position monitoring, and compliance checks. Prepared documentation for quarterly SEC filings related to fund holdings and performance. Fund Administration Assistant 06/2019 to 05/2021 Company Name City , State Assisted Fund Accountants with monthly general ledger entries and expense processing. Performed weekly bank reconciliations for fund operating accounts. Maintained and organized fund documentation for internal audit review. Education Bachelor of Science : Accounting 2019 State University Skills Investment Operations Associate, Trade Settlement, Reconciliation, NAV Calculation, Mutual Fund, Fixed Income, Equities, Aladdin, Operations, Finance""",{'fullContent': '...'},"{'SKILL': [{'word': 'Summa', 'score': 0.6181631088256836}, {'word': 'Ry Detail', 'score': 0.854280412197113}, {'word': 'Investment Operations', 'score': 0.8654413223266602}, {'word': 'Institutional Asset Management', 'score': 0.9354877471923828}, {'word': 'Fund Administration', 'score': 0.7549972534179688}, {'word': 'Trade Matching', 'score': 0.8166199922561646}, {'word': 'Settlement Processing', 'score': 0.9278888702392578}, {'word': 'Reconciliation', 'score': 0.9487602710723877}, {'word': 'NAV Calculation', 'score': 0.68473881483078}, {'word': 'Fixed Income', 'score': 0.9782524108886719}, {'word': 'Equity Portfolio', 'score': 0.8700013756752014}, {'word': 'Trade Matching', 'score': 0.995883047580719}, {'word': 'Settlement Securities Reconciliation', 'score': 0.9399056434631348}, {'word': 'AV Calculation', 'score': 0.77530837059021}, {'word': 'Fund Accounting Investment Platform', 'score': 0.9582308530807495}, {'word': 'Reg', 'score': 0.9299651980400085}, {'word': 'Ulatory Compliance', 'score': 0.8594262003898621}, {'word': 'Investment Operations', 'score': 0.9622942805290222}, {'word': 'Trade Matching', 'score': 0.9784506559371948}, {'word': 'Settlement', 'score': 0.933537483215332}, {'word': 'Fixed Income', 'score': 0.9422492980957031}, {'word': 'Equity Portfolio', 'score': 0.9618922472000122}, {'word': 'Trade Breaks', 'score': 0.5624542236328125}, {'word': 'Net Asset Value', 'score': 0.970772922039032}, {'word': 'Reconciliation', 'score': 0.8939371705055237}, {'word': 'Calculation', 'score': 0.6092237830162048}, {'word': 'Trade Entry', 'score': 0.7002325654029846}, {'word': 'Position Monitoring', 'score': 0.7146984338760376}, {'word': 'SEC', 'score': 0.6883529424667358}, {'word': 'Fund Holdings', 'score': 0.7154160737991333}, {'word': 'Fund Administration', 'score': 0.9846618175506592}, {'word': 'Assist', 'score': 0.6850859522819519}, {'word': 'Fund Accountants', 'score': 0.8996481895446777}, {'word': 'Bank Reconciliation', 'score': 0.9353174567222595}, {'word': 'Fund Operating Accounts', 'score': 0.6700931191444397}, {'word': 'Investment Operations', 'score': 0.7907009124755859}, {'word': 'Trade Settlement', 'score': 0.8763751983642578}, {'word': 'Reconciliation', 'score': 0.895751953125}, {'word': 'Calculation', 'score': 0.7832854390144348}, {'word': 'Mutual Fund', 'score': 0.9292435646057129}, {'word': 'Fixed Income', 'score': 0.8583734631538391}, {'word': 'Equities', 'score': 0.8067198991775513}, {'word': 'Aladdin', 'score': 0.7641981244087219}, {'word': 'Operations', 'score': 0.9008838534355164}, {'word': 'Finance', 'score': 0.9384515285491943}], 'EXP': [{'word': '4 Years', 'score': 0.9758154153823853}, {'word': 'Entries', 'score': 0.939910352230072}]}"
"""SITE RELIABILITY ENGINEER (SRE), FINTECH Summary Dedicated Site Reliability Engineer (SRE) with 6 years of experience ensuring the reliability, scalability, and performance of mission-critical FinTech services. Expertise in Cloud (AWS), automation (Python), monitoring (Prometheus), and implementing chaos engineering practices. Highlights Site Reliability Engineering (SRE) Cloud (AWS) & Infrastructure Automation (Python, Ansible) Monitoring & Alerting (Prometheus, Grafana) Kubernetes & Docker Chaos Engineering & Disaster Recovery Incident Management Experience Site Reliability Engineer (SRE), FinTech 01/2021 to Current Company Name City , State Led the SRE function for the **real-time loan decisioning microservices**, achieving **99.99% system uptime** through proactive monitoring and automation. Automated infrastructure provisioning and management using **Python and Terraform** in the **AWS** environment. Designed and implemented the **Prometheus and Grafana** monitoring stack for the Kubernetes-hosted application fleet. Developed and executed **Chaos Engineering experiments** to proactively identify failure points and improve system resilience. Managed the full incident response lifecycle and performed **root cause analysis (RCA)** for all critical outages. DevOps Engineer 06/2017 to 12/2020 Company Name City , State Built and maintained CI/CD pipelines (Jenkins) for multiple application teams. Managed configuration using Ansible and managed Docker container images. Provided Tier 3 support for performance-related production issues. Education Bachelor of Science : Computer Engineering 2017 State University AWS Certified Solutions Architect (2020) Skills Site Reliability Engineer, SRE, AWS, Python, Automation, Monitoring, Prometheus, Grafana, Kubernetes, Chaos Engineering, FinTech, Technology""",{'fullContent': '...'},"{'SKILL': [{'word': 'Site Relia', 'score': 0.9439509510993958}, {'word': 'Bility Engineer', 'score': 0.7589731812477112}, {'word': 'Fintech', 'score': 0.7397956252098083}, {'word': 'Cloud', 'score': 0.7374520897865295}, {'word': 'Python', 'score': 0.7711746692657471}, {'word': 'Chaos Engineering', 'score': 0.9939208626747131}, {'word': 'Site Reliability Engineering', 'score': 0.8898898363113403}, {'word': 'Cloud', 'score': 0.9467087388038635}, {'word': 'Infrastructure Automation', 'score': 0.9921680092811584}, {'word': 'Python', 'score': 0.8241674304008484}, {'word': 'Monitor', 'score': 0.9568706154823303}, {'word': 'Alert', 'score': 0.9774577617645264}, {'word': 'Kubernetes', 'score': 0.5646379590034485}, {'word': 'Chaos Engineering', 'score': 0.6108549237251282}, {'word': 'Disaster Recovery Incident Management', 'score': 0.957245945930481}, {'word': 'Reliability Engineer', 'score': 0.8855783939361572}, {'word': 'Microservice', 'score': 0.8792867660522461}, {'word': 'Netes', 'score': 0.5804480314254761}, {'word': 'Chaos Engineering', 'score': 0.9190089702606201}, {'word': 'Incident Response', 'score': 0.6917871832847595}, {'word': 'Root Cause Analysis', 'score': 0.8586940765380859}, {'word': 'Dev', 'score': 0.7903523445129395}, {'word': 'Ps Engineer', 'score': 0.8759860992431641}, {'word': 'CD Pipeline', 'score': 0.7442587018013}, {'word': 'Dock', 'score': 0.6241767406463623}, {'word': 'Tier 3', 'score': 0.6021062135696411}, {'word': 'Computer Engineering', 'score': 0.7681865692138672}, {'word': 'Solutions Architect', 'score': 0.6761552095413208}, {'word': 'Monitor', 'score': 0.7929463982582092}], 'TOOL': [{'word': 'Pro', 'score': 0.8137946128845215}, {'word': 'Heus', 'score': 0.5902088284492493}, {'word': 'Promet', 'score': 0.6346142888069153}, {'word': 'Heus', 'score': 0.7007866501808167}, {'word': 'Grafana', 'score': 0.5891439914703369}, {'word': 'Fintech', 'score': 0.6758412718772888}, {'word': 'Python', 'score': 0.8430676460266113}, {'word': 'Terraform', 'score': 0.7823110222816467}, {'word': 'AWS', 'score': 0.646216094493866}, {'word': 'Prometheus', 'score': 0.7096163630485535}, {'word': 'Grafana', 'score': 0.6725570559501648}], 'EXP': [{'word': '6 Years', 'score': 0.9573183059692383}, {'word': 'Loan', 'score': 0.6139756441116333}, {'word': 'Uptime', 'score': 0.9242933988571167}, {'word': 'Provisioning', 'score': 0.6249641180038452}, {'word': 'Management', 'score': 0.5854430794715881}, {'word': 'Cycle', 'score': 0.5743294358253479}, {'word': 'Out', 'score': 0.8701541423797607}]}"
"""BRANCH SALES & SERVICE MANAGER Summary Results-driven Branch Sales & Service Manager with 9 years of banking experience, focused on achieving aggressive sales targets, deepening client relationships, and managing service operations. Proven leader in coaching high-performing teams and integrating digital service channels. Highlights Sales Strategy & Coaching Performance Management Customer Relationship Management Branch Operations & Service Quality Digital Channel Adoption & Support Consumer Lending & New Accounts Experience Branch Sales & Service Manager 01/2020 to Current Company Name City , State Directed the **sales and service strategy** for a busy retail branch, achieving **115% of annual consumer loan and deposit targets**. Managed and coached a team of 10 staff members (Bankers, Tellers), conducting weekly sales meetings and regular performance reviews. Personally managed high-value client relationships, leading to a 20% increase in **Wealth Management referrals**. Oversaw the **service quality matrix**, resolving complex customer complaints and driving digital platform adoption (mobile/online). Ensured front-of-house operations met compliance and security standards. Senior Relationship Banker 06/2016 to 12/2019 Company Name City , State Achieved top-tier ranking for cross-selling a full suite of bank products (loans, credit cards, investments). Trained new hires on sales processes and customer needs assessment. Education Bachelor of Arts : Business Management 2016 State University Skills Branch Sales & Service Manager, Sales Strategy, Coaching, Performance Management, Customer Relationship Management, Retail Banking, Consumer Lending, Finance""",{'fullContent': '...'},"{'TOOLS': [{'word': 'CH SALES', 'score': 0.5980421304702759}], 'SKILL': [{'word': 'Results', 'score': 0.8894488215446472}, {'word': 'Branch Sales', 'score': 0.9881864190101624}, {'word': 'Service Manager', 'score': 0.9800981879234314}, {'word': 'Sales Strategy', 'score': 0.9930410385131836}, {'word': 'Coaching', 'score': 0.8776527643203735}, {'word': 'Management Customer Relationship Management', 'score': 0.7957004904747009}, {'word': 'Branch Operations', 'score': 0.7275065779685974}, {'word': 'Service', 'score': 0.7758390307426453}, {'word': 'Channel Adoption', 'score': 0.9657456874847412}, {'word': 'Support', 'score': 0.857252836227417}, {'word': 'Consumer Lending', 'score': 0.967975914478302}, {'word': 'New Accounts', 'score': 0.8286337852478027}, {'word': 'Branch Sales', 'score': 0.929915189743042}, {'word': 'Service Manager', 'score': 0.8074632883071899}, {'word': 'Service', 'score': 0.751416802406311}, {'word': 'Th Management', 'score': 0.7402603626251221}, {'word': 'Bank', 'score': 0.6662545204162598}, {'word': 'Bank Products', 'score': 0.6364791393280029}, {'word': 'Credit Cards', 'score': 0.711493194103241}, {'word': 'Investments', 'score': 0.6808711290359497}, {'word': 'Sales Processes', 'score': 0.7457154989242554}, {'word': 'Customer', 'score': 0.6910736560821533}, {'word': 'Business Management', 'score': 0.5950404405593872}, {'word': 'Service Manager', 'score': 0.7507098913192749}, {'word': 'Sales Strategy', 'score': 0.9764251708984375}, {'word': 'Coaching', 'score': 0.7277116179466248}, {'word': 'Performance Management', 'score': 0.8986470699310303}, {'word': 'Custom', 'score': 0.9393389821052551}, {'word': 'Er Relationship Management', 'score': 0.9242622256278992}, {'word': 'Tail Banking', 'score': 0.812324047088623}, {'word': 'Consumer Lending', 'score': 0.9932410717010498}, {'word': 'Finance', 'score': 0.8389370441436768}], 'EXP': [{'word': '9 Years', 'score': 0.9495035409927368}, {'word': 'Banking Experience', 'score': 0.6402190923690796}, {'word': 'Client Relationships', 'score': 0.6102619171142578}, {'word': 'Loan', 'score': 0.601927638053894}, {'word': 'Targets', 'score': 0.623100996017456}, {'word': 'Adoption', 'score': 0.8021833896636963}]}"
"""DATA SCIENTIST, QUANTITATIVE RESEARCH Summary Quantitative Data Scientist with 5 years of experience in statistical analysis, predictive modeling, and data visualization for fixed income and equity research. Expertise in R, Python, time series analysis, and communicating complex analytical findings to portfolio managers. Highlights R & Python (Stats Modeling, SciPy) Statistical & Time Series Analysis Fixed Income & Equity Research Predictive Modeling & Backtesting Data Visualization (R Shiny, Tableau) SQL & Data Warehousing Experience Data Scientist, Quantitative Research 01/2021 to Current Company Name City , State Developed and implemented **time series models (ARIMA, GARCH)** in **R** to forecast bond yield volatility for the Fixed Income desk. Used **Python and statistical methods** to backtest and evaluate the performance of equity factor models, identifying new alpha signals. Built interactive **data visualization dashboards (R Shiny)** for Portfolio Managers to monitor risk exposures and performance attribution. Wrote production-ready **SQL** to extract and aggregate high-frequency trading data for analysis. Collaborated with IT to optimize data storage and access patterns in the research data warehouse. Quantitative Analyst 06/2018 to 12/2020 Company Name City , State Performed statistical analysis and ad-hoc reporting for the Equity Research team. Assisted in cleaning and normalizing large datasets using R and SQL. Documented model assumptions and limitations for internal review. Education Master of Science : Statistics 2018 State University Skills Data Scientist, Quantitative Research, R, Python, Statistical Analysis, Time Series, Fixed Income, Equity Research, Predictive Modeling, Data Visualization, Technology""",{'fullContent': '...'},"{'SKILL': [{'word': 'Uant', 'score': 0.9661209583282471}, {'word': 'Itative Data Scientist', 'score': 0.8764081001281738}, {'word': 'Statistical Analysis', 'score': 0.9764506816864014}, {'word': 'Predict', 'score': 0.88761967420578}, {'word': 'Modeling', 'score': 0.9842666983604431}, {'word': 'Visualization', 'score': 0.8238767385482788}, {'word': 'Fixed Income', 'score': 0.6454814672470093}, {'word': 'Equity Research', 'score': 0.9706112146377563}, {'word': 'Python', 'score': 0.7859246730804443}, {'word': 'Time Series Analysis', 'score': 0.9893589019775391}, {'word': 'Analytical', 'score': 0.985424816608429}, {'word': 'Python', 'score': 0.6762229800224304}, {'word': 'Ats Modeling', 'score': 0.9860188961029053}, {'word': 'Statistical', 'score': 0.975642204284668}, {'word': 'Time Series Analysis', 'score': 0.9403243660926819}, {'word': 'Xed Income', 'score': 0.9663382172584534}, {'word': 'Equity Research', 'score': 0.9763962030410767}, {'word': 'Modeling', 'score': 0.9870176315307617}, {'word': 'Backtest', 'score': 0.9113102555274963}, {'word': 'Visualization', 'score': 0.9361435174942017}, {'word': 'SQL', 'score': 0.6081428527832031}, {'word': 'Data Warehousing', 'score': 0.8538075089454651}, {'word': 'Scientist', 'score': 0.7868123650550842}, {'word': 'Uant', 'score': 0.9446640014648438}, {'word': 'Itative Research', 'score': 0.9339081645011902}, {'word': 'Yield', 'score': 0.6088567972183228}, {'word': 'Xed Income', 'score': 0.9337489604949951}, {'word': 'Statistical Methods', 'score': 0.84297776222229}, {'word': 'Equity Factor Models', 'score': 0.980479896068573}, {'word': 'Data Visualization', 'score': 0.7108073830604553}, {'word': 'Portfo', 'score': 0.9088946580886841}, {'word': 'Lio Manager', 'score': 0.9530150890350342}, {'word': 'Production', 'score': 0.7164517641067505}, {'word': 'Trading', 'score': 0.7651215195655823}, {'word': 'Storage', 'score': 0.7039832472801208}, {'word': 'Uant', 'score': 0.9265138506889343}, {'word': 'Itative Analy', 'score': 0.6546998620033264}, {'word': 'Statistical Analysis', 'score': 0.9634461998939514}, {'word': 'Equity Research', 'score': 0.9808424711227417}, {'word': 'Uant', 'score': 0.9548330307006836}, {'word': 'Itative Research', 'score': 0.7758634090423584}, {'word': 'Statistical Analysis', 'score': 0.9138097763061523}, {'word': 'Time Series', 'score': 0.854520857334137}, {'word': 'Inc', 'score': 0.9650692939758301}, {'word': 'Equity Research', 'score': 0.8627321720123291}, {'word': 'Model', 'score': 0.9639753699302673}, {'word': 'Visual', 'score': 0.8894925713539124}, {'word': 'Technology', 'score': 0.9235058426856995}], 'EXP': [{'word': '5 Years', 'score': 0.9826475977897644}], 'TOOL': [{'word': 'Scip', 'score': 0.6022992730140686}, {'word': 'R Shiny', 'score': 0.8995638489723206}, {'word': 'Tableau', 'score': 0.770595133304596}, {'word': 'ARIMA', 'score': 0.6044383645057678}, {'word': 'Interactive', 'score': 0.6696341037750244}, {'word': 'R Shiny', 'score': 0.9150762557983398}, {'word': 'SQL', 'score': 0.6616541743278503}, {'word': 'SQL', 'score': 0.6652575731277466}], 'ORG': [{'word': 'City', 'score': 0.5854863524436951}]}"
