text,meta,extracted_entities
"""MORTGAGE LOAN OFFICER Summary A dedicated, results-oriented sales professional with extensive experience in the financial services industry. Proven ability to originate a high volume of mortgage loans while maintaining superior customer service and strict compliance with regulatory guidelines. Seeking a challenging role to utilize sales, financial analysis, and relationship management skills. Highlights FHA/VA/Conventional Loan Expertise Strong Sales & Negotiation Skills Compliance & Regulatory Knowledge Financial Analysis & Credit Underwriting Pipeline Management Customer Relationship Management MS Office Suite Proficiency Experience Mortgage Loan Officer 03/2018 to Current Company Name City , State Originate FHA, VA, and Conventional mortgage loans by proactively soliciting new business and managing an active pipeline. Consistently exceed monthly sales goals by maintaining strong relationships with real estate agents, builders, and financial planners. Conduct comprehensive financial analysis of client creditworthiness, income, and assets to determine loan feasibility and present suitable mortgage products. Ensure strict adherence to all federal, state, and local lending regulations and internal bank policies. Provide exceptional customer service, acting as the primary point of contact from application to closing. Process and submit complete and accurate loan packages to underwriting for timely approval. Loan Processor 06/2015 to 02/2018 Company Name City , State Managed a pipeline of 40-50 mortgage loan applications, ensuring all required documentation was collected and verified for submission. Liaised between loan officers, underwriters, and closing agents to resolve discrepancies and expedite the closing process. Performed initial review of credit reports, appraisals, and title commitments for accuracy and compliance. Maintained clear and consistent communication with clients, providing regular updates on loan status. Trained new hires on proprietary loan processing software and company procedures. Education Bachelor of Arts : Finance 2015 State University Finance and Economics Skills Sales, Financial Analysis, Customer Service, Loan Origination, Underwriting, Compliance, Mortgage, FHA, VA, Conventional, Credit, Negotiation, Pipeline Management, Real Estate, MS Office, Relationship Management""",{'fullContent': '...'},"{'SKILL': [{'word': 'Mma', 'score': 0.5569510459899902}, {'word': 'Results', 'score': 0.9858017563819885}, {'word': 'Sales Professional', 'score': 0.8332037925720215}, {'word': 'Financial Services Industry', 'score': 0.8280910849571228}, {'word': 'Mortgage Loans', 'score': 0.9877400398254395}, {'word': 'Regulatory Guidelines', 'score': 0.7321141362190247}, {'word': 'Sales', 'score': 0.9832466244697571}, {'word': 'Financial Analysis', 'score': 0.9976701736450195}, {'word': 'Relationship Management', 'score': 0.9925975799560547}, {'word': 'Convention', 'score': 0.9201452136039734}, {'word': 'Loan', 'score': 0.9908705949783325}, {'word': 'Sales', 'score': 0.809823751449585}, {'word': 'Negotiation Skills Compliance', 'score': 0.9274360537528992}, {'word': 'Regulatory Knowledge', 'score': 0.9220258593559265}, {'word': 'Financial Analysis', 'score': 0.9966721534729004}, {'word': 'Credit Underwriting Pipeline Management Custom', 'score': 0.9737407565116882}, {'word': 'Relationship Management', 'score': 0.9057249426841736}, {'word': 'Proficiency Experience Mortgage Loan Officer', 'score': 0.8773156404495239}, {'word': 'Convention', 'score': 0.7719591856002808}, {'word': 'Mortgage Loans', 'score': 0.8517966270446777}, {'word': 'Sales Goals', 'score': 0.6637085676193237}, {'word': 'Real Estate Agents', 'score': 0.9658281803131104}, {'word': 'Financial Plan', 'score': 0.9948068261146545}, {'word': 'Financial Analysis', 'score': 0.9971156120300293}, {'word': 'Client Creditworthiness', 'score': 0.9755527973175049}, {'word': 'Income', 'score': 0.698436975479126}, {'word': 'Assets', 'score': 0.9457430839538574}, {'word': 'Loan F', 'score': 0.7877563834190369}, {'word': 'Ibility', 'score': 0.6865397691726685}, {'word': 'Mortgage Products', 'score': 0.9305943846702576}, {'word': 'Federal', 'score': 0.9327618479728699}, {'word': 'Lending', 'score': 0.9343782663345337}, {'word': 'Bank Policies', 'score': 0.8788372278213501}, {'word': 'Loan Packages', 'score': 0.7165863513946533}, {'word': 'Writing', 'score': 0.6574779152870178}, {'word': 'Loan Process', 'score': 0.7350589632987976}, {'word': 'Mortgage Loan Applications', 'score': 0.8524616360664368}, {'word': 'Loan', 'score': 0.8572447299957275}, {'word': 'Credit Reports', 'score': 0.9736034870147705}, {'word': 'Sal', 'score': 0.6282969117164612}, {'word': 'Title Commitments', 'score': 0.6133774518966675}, {'word': 'Education', 'score': 0.9483740925788879}, {'word': 'Finance', 'score': 0.9757438898086548}, {'word': 'State', 'score': 0.8410335183143616}, {'word': 'University Finance', 'score': 0.6148234605789185}, {'word': 'Economics Skills', 'score': 0.7821497321128845}, {'word': 'Sales', 'score': 0.793730616569519}, {'word': 'Financial Analysis', 'score': 0.9848793745040894}, {'word': 'Custom', 'score': 0.956967830657959}, {'word': 'Service', 'score': 0.9626635909080505}, {'word': 'Loan Origination', 'score': 0.8004223704338074}, {'word': 'Writing', 'score': 0.9840019941329956}, {'word': 'Compliance', 'score': 0.5559939742088318}, {'word': 'Mortgage', 'score': 0.6966603398323059}, {'word': 'Convention', 'score': 0.6809489727020264}, {'word': 'Credit', 'score': 0.955354630947113}, {'word': 'Tiation', 'score': 0.8262151479721069}, {'word': 'Pipeline Management', 'score': 0.5735229253768921}, {'word': 'Real Estate', 'score': 0.9062474966049194}, {'word': 'Office', 'score': 0.8578236699104309}, {'word': 'Relationship Management', 'score': 0.9427008628845215}], 'EXP': [{'word': 'Service', 'score': 0.6947711706161499}, {'word': 'Service', 'score': 0.8252148628234863}, {'word': 'Closing', 'score': 0.5571815371513367}]}"
"""COMPLIANCE ANALYST Summary Highly analytical and detail-oriented compliance professional with 5 years of experience in the banking and financial services industry. Expertise in regulatory interpretation, risk assessment, and developing effective internal controls. Committed to upholding the highest standards of integrity and regulatory adherence. Highlights AML/KYC/OFAC Compliance Risk Assessment Internal Auditing Policy & Procedure Development Regulatory Reporting Microsoft Excel & SQL Data Analysis Experience Compliance Analyst 10/2019 to Current Company Name City , State Conduct risk-based reviews of client accounts and transactions to ensure compliance with **AML, KYC, and OFAC regulations**. Draft and file **Suspicious Activity Reports (SARs)** as required by FinCEN guidelines. Collaborate with cross-functional teams (Legal, Operations, IT) to implement new compliance policies and system enhancements. Perform **internal audits** of branch operations to assess adherence to federal regulations and internal controls. Maintain and update the compliance training curriculum for new and existing employees. Generated monthly compliance monitoring reports for senior management detailing risk exposure and remediation efforts. Compliance Associate 04/2017 to 09/2019 Company Name City , State Assisted in the **daily monitoring of transactions** and customer data for potential red flags. Reviewed and processed **new customer onboarding documentation** for completeness and accuracy, focusing on **CIP (Customer Identification Program)** requirements. Researched and summarized new regulatory changes impacting bank operations. Managed and organized the department's compliance document repository using SharePoint. Supported external regulatory examinations by gathering and organizing requested documentation. Education Master of Science : Financial Services 2017 City University Financial Regulation and Compliance Skills AML, KYC, OFAC, Compliance, Risk Assessment, Internal Auditing, Regulatory Reporting, SARs, Data Analysis, SQL, Policy Development, Training, Operations, Financial Services, Microsoft Excel""",{'fullContent': '...'},"{'TOOL': [{'word': 'KYC', 'score': 0.6669750809669495}, {'word': 'Harepoint', 'score': 0.5541456341743469}], 'SKILL': [{'word': 'Mma', 'score': 0.5951595306396484}, {'word': 'Analytical', 'score': 0.9614275097846985}, {'word': 'Detail', 'score': 0.727266788482666}, {'word': 'Compliance Professional', 'score': 0.7729684114456177}, {'word': 'Banking', 'score': 0.9785751104354858}, {'word': 'Financial Services', 'score': 0.985080897808075}, {'word': 'Regulatory Interpretation', 'score': 0.9951220154762268}, {'word': 'Risk Assessment', 'score': 0.9680643081665039}, {'word': 'Regulatory Adherence', 'score': 0.9137253761291504}, {'word': 'Risk Assessment', 'score': 0.97307288646698}, {'word': 'Auditing Policy', 'score': 0.9839828014373779}, {'word': 'Procedure Development', 'score': 0.7556463479995728}, {'word': 'Ulatory Report', 'score': 0.9462903738021851}, {'word': 'QL Data Analysis', 'score': 0.7776685357093811}, {'word': 'Liance Analy', 'score': 0.7759649157524109}, {'word': 'State Con', 'score': 0.8337098360061646}, {'word': 'Suspicious Activity Reports', 'score': 0.7668068408966064}, {'word': 'Legal', 'score': 0.9458804726600647}, {'word': 'Operations', 'score': 0.582190752029419}, {'word': 'Federal', 'score': 0.8770338892936707}, {'word': 'Compliance Training', 'score': 0.9173541069030762}, {'word': 'Company Name City', 'score': 0.7831456065177917}, {'word': 'State As', 'score': 0.7828655242919922}, {'word': 'Customer Identification Program', 'score': 0.979656457901001}, {'word': 'Regulatory Changes', 'score': 0.7799124717712402}, {'word': 'Bank Operations', 'score': 0.9732580184936523}, {'word': 'Regulatory Examinations', 'score': 0.9064877033233643}, {'word': 'Education', 'score': 0.570993959903717}, {'word': 'Financial Services', 'score': 0.989008903503418}, {'word': 'City University', 'score': 0.7052682638168335}, {'word': 'Financial Regulation', 'score': 0.9603251218795776}, {'word': 'Compliance Skills', 'score': 0.8647884130477905}, {'word': 'Compliance', 'score': 0.8682253360748291}, {'word': 'Risk Assessment', 'score': 0.9768949747085571}, {'word': 'Internal Auditing', 'score': 0.8037182688713074}, {'word': 'Reg', 'score': 0.933407187461853}, {'word': 'Ulatory Report', 'score': 0.8013385534286499}, {'word': 'Data Analysis', 'score': 0.9544210433959961}, {'word': 'Policy Development', 'score': 0.9869399070739746}, {'word': 'Training', 'score': 0.9062097668647766}, {'word': 'Operations', 'score': 0.9784899353981018}, {'word': 'Financial Services', 'score': 0.981009304523468}], 'EXP': [{'word': '5 Years', 'score': 0.97893887758255}]}"
"""COMMERCIAL LENDING ASSOCIATE Summary Results-driven commercial banking professional with a strong foundation in credit analysis, financial modeling, and client relationship management. Successfully supported a portfolio of over 75 commercial clients with revenues up to $50 million. Committed to fostering business growth and managing credit risk. Highlights Commercial Credit Analysis Financial Modeling & Valuation Cash Flow Forecasting Loan Documentation & Closing Financial Statement Spreading Risk Mitigation Client Relationship Management Microsoft Excel (Advanced) Experience Commercial Lending Associate 01/2019 to Current Company Name City , State **Prepared comprehensive credit approval memorandums** for new and existing commercial loans, including C&I and Commercial Real Estate, ranging from $1M to $15M. Conducted thorough **financial statement and tax return analysis** to assess borrower repayment capacity and assign internal risk ratings. Managed all post-closing due diligence, including **covenant tracking and collateral monitoring** to ensure portfolio compliance. Partnered with Relationship Managers to cross-sell banking products and **cultivate long-term client relationships**. Oversaw the loan closing process, coordinating with legal counsel and title companies to ensure accurate and timely documentation. Created **pro forma financial models** to evaluate the viability of client expansion projects and potential acquisitions. Credit Analyst 07/2016 to 12/2018 Company Name City , State Performed detailed **cash flow and sensitivity analysis** on business borrowers for commercial loan renewals. Spread and analyzed financial statements for all assigned portfolio companies using Moody's Risk Analyst software. Assisted senior underwriters in preparing quarterly portfolio review reports for management. Researched industry trends and local market conditions to support lending decisions and identify potential risks. Education Bachelor of Science : Accounting 2016 State College Minor in Economics Skills Commercial Lending, Credit Analysis, Financial Analysis, Financial Modeling, Risk Management, Client Relations, Loan Documentation, C&I, Commercial Real Estate, Accounting, Tax Returns, Microsoft Excel, Moody's""",{'fullContent': '...'},"{'TOOLS': [{'word': 'Moody', 'score': 0.7217464447021484}, {'word': 'Analyst', 'score': 0.6685020923614502}], 'SKILL': [{'word': 'E Summary Results', 'score': 0.6588135957717896}, {'word': 'Commercial Banking', 'score': 0.9883583188056946}, {'word': 'Credit Analysis', 'score': 0.9937552213668823}, {'word': 'Financial Modeling', 'score': 0.9959985613822937}, {'word': 'Client Relationship Management', 'score': 0.9829955101013184}, {'word': 'Portfolio', 'score': 0.7214881777763367}, {'word': 'Credit Risk', 'score': 0.9904301166534424}, {'word': 'Commercial Credit Analysis', 'score': 0.9279096126556396}, {'word': 'Financial Modeling', 'score': 0.9967210292816162}, {'word': 'Val', 'score': 0.7297084927558899}, {'word': 'Valuation Cash Flow Forecasting Loan Documentation', 'score': 0.8866276144981384}, {'word': 'Closing', 'score': 0.9719803333282471}, {'word': 'Financial State', 'score': 0.9887622594833374}, {'word': 'Risk Mi', 'score': 0.977276086807251}, {'word': 'Gation Client Relationship Management', 'score': 0.9611551761627197}, {'word': 'Commercial Lending', 'score': 0.9906449913978577}, {'word': 'Credit Approval', 'score': 0.9692345857620239}, {'word': 'Loans', 'score': 0.6979799866676331}, {'word': 'C & I', 'score': 0.8825162053108215}, {'word': 'Commercial Real Estate', 'score': 0.9895521998405457}, {'word': 'Financial Statement', 'score': 0.9949365854263306}, {'word': 'Tax Return Analysis', 'score': 0.9649674296379089}, {'word': 'Borrow', 'score': 0.9102018475532532}, {'word': 'Repayment Capacity', 'score': 0.8712142109870911}, {'word': 'Risk', 'score': 0.8194906115531921}, {'word': 'Closing Due Di', 'score': 0.5782001614570618}, {'word': 'Ant Tracking', 'score': 0.8606802225112915}, {'word': 'Llateral Monitoring', 'score': 0.8849906325340271}, {'word': 'Portfolio Compliance', 'score': 0.8760087490081787}, {'word': 'Relations', 'score': 0.9845974445343018}, {'word': 'Hip Manager', 'score': 0.9679076671600342}, {'word': 'Banking Products', 'score': 0.9545512199401855}, {'word': 'Client', 'score': 0.6680552959442139}, {'word': 'Loan Closing', 'score': 0.8653839826583862}, {'word': 'Legal Counsel', 'score': 0.8067246675491333}, {'word': 'Financial Models', 'score': 0.8359388709068298}, {'word': 'Via', 'score': 0.6816707253456116}, {'word': 'Client Expansion', 'score': 0.7284384965896606}, {'word': 'Credit Analyst', 'score': 0.8517247438430786}, {'word': 'Cash Flow', 'score': 0.9033194780349731}, {'word': 'Sensitivity Analysis', 'score': 0.8134560585021973}, {'word': 'Business Borrow', 'score': 0.9341210722923279}, {'word': 'Loan Renewal', 'score': 0.9252297282218933}, {'word': 'Financial Statements', 'score': 0.9952220916748047}, {'word': 'Portfolio', 'score': 0.6321238279342651}, {'word': 'Risk', 'score': 0.8231783509254456}, {'word': 'Under', 'score': 0.8863535523414612}, {'word': 'Portfolio Review', 'score': 0.8682834506034851}, {'word': 'Lending', 'score': 0.9814774394035339}, {'word': 'Risks', 'score': 0.9551877975463867}, {'word': 'Education', 'score': 0.980970561504364}, {'word': 'Accounting', 'score': 0.973972499370575}, {'word': 'State College Minor', 'score': 0.6709508895874023}, {'word': 'Economics Skills', 'score': 0.860374927520752}, {'word': 'Commercial Lending', 'score': 0.9769439101219177}, {'word': 'Credit Analysis', 'score': 0.9863132238388062}, {'word': 'Financial Analysis', 'score': 0.9897803068161011}, {'word': 'Financial Model', 'score': 0.988548994064331}, {'word': 'Risk Management', 'score': 0.9885511994361877}, {'word': 'Relations', 'score': 0.9850967526435852}, {'word': 'Docume', 'score': 0.922507643699646}, {'word': 'Commercial Real Estate', 'score': 0.9645066261291504}, {'word': 'Accounting', 'score': 0.9795598983764648}, {'word': 'Tax Return', 'score': 0.8501754999160767}], 'EXP': [{'word': 'Million', 'score': 0.7771437168121338}, {'word': '15M', 'score': 0.5692858695983887}]}"
"""BRANCH OPERATIONS MANAGER Summary Experienced banking operations leader with a 10-year track record of improving efficiency, ensuring regulatory compliance, and delivering exceptional customer service. Proven ability to manage large teams and streamline complex branch procedures. Highlights Operations Management Regulatory Compliance (Reg CC, BSA, Teller Audits) Staff Supervision & Training Risk Management & Loss Prevention Cash Handling & Reconciliation Process Improvement Customer Experience & Service Excellence Microsoft Office Suite Experience Branch Operations Manager 05/2017 to Current Company Name City , State Direct and oversee all daily branch operations, managing a team of 15 tellers and personal bankers to meet service and compliance goals. Responsible for **cash management**, including **vault balancing, ATM reconciliation**, and ensuring adequate cash levels within defined limits. Conduct **weekly and monthly internal audits** (teller drawers, dual control, security logs) to mitigate operational risk and ensure **BSA/AML compliance**. Developed and implemented **new teller training modules** that resulted in a 20% reduction in cash handling errors over 6 months. Manage and resolve all escalated customer complaints and complex transactional issues, maintaining a superior **customer satisfaction** rating. Prepare and present **daily and monthly operational performance reports** to the District Manager. Head Teller 08/2014 to 04/2017 Company Name City , State Supervised a team of 5 tellers, managing the daily workflow and ensuring efficient processing of all customer transactions. Authored the **branch's quarterly compliance certification reports** for management review. Performed **end-of-day settlement and general ledger reconciliation**, maintaining a near-zero error rate. Provided **front-line leadership** by coaching staff on proper policy adherence and identifying cross-sell opportunities. Managed all aspects of new-hire on-the-job training for the teller line. Education Associate of Science : Business Administration 2014 Community College Business Management Skills Operations Management, Branch Management, Compliance, BSA, AML, Risk Management, Cash Handling, Reconciliation, Customer Service, Staff Training, Process Improvement, Audits, Teller, Microsoft Office""",{'fullContent': '...'},"{'SKILL': [{'word': 'Banking Operations', 'score': 0.9943634271621704}, {'word': 'Regulatory Compliance', 'score': 0.9633743166923523}, {'word': 'Branch', 'score': 0.8430048227310181}, {'word': 'Operations Management Reg', 'score': 0.9051193594932556}, {'word': 'Ulatory Compliance', 'score': 0.8587464094161987}, {'word': 'Teller Audits', 'score': 0.746717631816864}, {'word': 'Super', 'score': 0.8821842670440674}, {'word': 'Risk Management', 'score': 0.7603410482406616}, {'word': 'Loss Prevention', 'score': 0.9451518058776855}, {'word': 'Cash Handling', 'score': 0.8418088555335999}, {'word': 'Recon', 'score': 0.7807909846305847}, {'word': 'Liation Process Improvement Customer Experience', 'score': 0.83892422914505}, {'word': 'Service', 'score': 0.8987368941307068}, {'word': 'Microsoft Office Suite', 'score': 0.8135170936584473}, {'word': 'Branch Operations', 'score': 0.7175523638725281}, {'word': 'Cash Management', 'score': 0.9066213965415955}, {'word': 'Vault Balancing', 'score': 0.9098942279815674}, {'word': 'ATM Reconciliation', 'score': 0.8093252182006836}, {'word': 'Cash Levels', 'score': 0.8784985542297363}, {'word': 'Dual Control', 'score': 0.7599654197692871}, {'word': 'Security Logs', 'score': 0.7094780802726746}, {'word': 'Operational Risk', 'score': 0.7845357656478882}, {'word': 'BSA', 'score': 0.7088737487792969}, {'word': 'AML Compliance', 'score': 0.560251772403717}, {'word': 'Teller Training', 'score': 0.9160470962524414}, {'word': 'Cash Handling', 'score': 0.7894997596740723}, {'word': 'Transactional', 'score': 0.6311591863632202}, {'word': 'District', 'score': 0.6326321363449097}, {'word': 'Compliance', 'score': 0.8224931955337524}, {'word': 'General Ledger Reconciliation', 'score': 0.9030901789665222}, {'word': 'Education', 'score': 0.9260400533676147}, {'word': 'Business Administration', 'score': 0.8651812672615051}, {'word': 'Business Management', 'score': 0.8793076872825623}, {'word': 'Operations Management', 'score': 0.9337308406829834}, {'word': 'Management', 'score': 0.9137722849845886}, {'word': 'Risk Management', 'score': 0.7884780764579773}, {'word': 'Cash', 'score': 0.9641375541687012}, {'word': 'Tion', 'score': 0.9062831997871399}, {'word': 'Custom', 'score': 0.6144052147865295}, {'word': 'Service', 'score': 0.838344156742096}, {'word': 'Training', 'score': 0.911545991897583}, {'word': 'Process Improvement', 'score': 0.7697731256484985}, {'word': 'Microsoft Office', 'score': 0.6510321497917175}], 'EXP': [{'word': '10 - Year', 'score': 0.9008519053459167}, {'word': 'Service', 'score': 0.7961354851722717}, {'word': 'Operations', 'score': 0.8569339513778687}, {'word': '15 Tell', 'score': 0.5668788552284241}, {'word': '6 Months', 'score': 0.9917781352996826}, {'word': '5 Tell', 'score': 0.6751656532287598}]}"
