text,meta,extracted_entities
"""SOFTWARE ENGINEER, FINTECH PLATFORM Summary Expert Software Engineer with 7 years of experience in the full-stack development of high-volume, low-latency trading and payments platforms. Expertise in Java, Spring, React, and relational/NoSQL databases. Dedicated to scalable architecture and clean code. Highlights Java, Spring Boot/Framework Full-Stack Development (React, TypeScript) Microservices & RESTful APIs Low-Latency & High-Throughput Systems SQL (PostgreSQL), NoSQL (MongoDB) Agile (Scrum) & DevOps CI/CD Experience Software Engineer, FinTech Platform 03/2021 to Current Company Name City , State Led the **design and implementation of the core payments microservice** using **Java 17 and Spring Boot**, handling over 5 million transactions daily with sub-20ms latency. Developed responsive **front-end user interfaces (React/TypeScript)** for the client transaction monitoring portal. Architected and deployed services using **Kubernetes and Docker** in an **AWS** cloud environment, fully automated via CI/CD (Jenkins). Optimized **PostgreSQL** database schemas and complex queries to support high concurrency under peak load. Mentored junior developers on best practices for performance tuning and secure coding. Senior Developer 06/2018 to 02/2021 Company Name City , State Contributed to the development of the high-frequency trading matching engine using **C++ and Python**. Built ETL pipelines for regulatory data reporting (MiFID II) using **Python and Spark**. Performed performance profiling and optimization of critical code paths, achieving a 15% reduction in CPU utilization. Participated actively in code reviews and utilized Jira for sprint management. Education Master of Science : Computer Science 2018 State University Skills Software Engineer, Java, Spring Boot, React, Full-Stack, Microservices, FinTech, Payments, Low-Latency, SQL, Docker, Kubernetes, AWS, C++, Python, Agile""",{'fullContent': '...'},"{'TOOL': [{'word': 'Postg', 'score': 0.576097846031189}, {'word': 'Res', 'score': 0.6683463454246521}, {'word': 'Mongod', 'score': 0.5578209757804871}, {'word': 'Java', 'score': 0.7106258869171143}, {'word': 'Kubernet', 'score': 0.7440366148948669}, {'word': 'Docker', 'score': 0.811996579170227}, {'word': '/ CD', 'score': 0.5871982574462891}, {'word': 'Jenkins', 'score': 0.5904455780982971}, {'word': 'Post', 'score': 0.7763901948928833}, {'word': 'Res', 'score': 0.6354488134384155}], 'SKILL': [{'word': 'M Summary Ex', 'score': 0.8476355671882629}, {'word': 'Software Engineer', 'score': 0.9589563608169556}, {'word': 'Full', 'score': 0.6194350719451904}, {'word': 'Stack', 'score': 0.702186644077301}, {'word': 'Volume', 'score': 0.5936718583106995}, {'word': 'Low', 'score': 0.8146543502807617}, {'word': 'Latency Trading', 'score': 0.9352750778198242}, {'word': 'Payments Platforms', 'score': 0.7150473594665527}, {'word': 'Java', 'score': 0.9893651008605957}, {'word': 'Spring', 'score': 0.8474089503288269}, {'word': 'React', 'score': 0.8421040773391724}, {'word': 'Relational', 'score': 0.854426920413971}, {'word': 'Nosql Databases', 'score': 0.9592229723930359}, {'word': 'Java', 'score': 0.960981547832489}, {'word': 'Spring Boot', 'score': 0.9590139389038086}, {'word': 'Framework Full', 'score': 0.642574667930603}, {'word': 'Stack Development', 'score': 0.9911997318267822}, {'word': 'React', 'score': 0.8789548873901367}, {'word': 'Typescript', 'score': 0.9770470857620239}, {'word': 'Microservices', 'score': 0.9570873379707336}, {'word': 'Estful API', 'score': 0.9281015992164612}, {'word': 'Low', 'score': 0.7712917923927307}, {'word': 'Latency', 'score': 0.9900484085083008}, {'word': 'High', 'score': 0.6929793357849121}, {'word': 'Throughput Systems SQL', 'score': 0.9895704984664917}, {'word': 'Nosql', 'score': 0.8353829383850098}, {'word': 'Agile Scrum', 'score': 0.9254149198532104}, {'word': 'Devops CI', 'score': 0.9004552960395813}, {'word': 'CD Experience Software Engineer', 'score': 0.9169210195541382}, {'word': 'Ech Platform', 'score': 0.8530339002609253}, {'word': 'Company Name City', 'score': 0.7334621548652649}, {'word': 'Payments Microservice', 'score': 0.9010374546051025}, {'word': 'Spring Boot', 'score': 0.9009966850280762}, {'word': 'Spons', 'score': 0.7549850940704346}, {'word': 'Front', 'score': 0.7138872742652893}, {'word': 'End User', 'score': 0.8780840635299683}, {'word': 'React', 'score': 0.7641804218292236}, {'word': 'Typescript', 'score': 0.8723867535591125}, {'word': 'Client Transaction', 'score': 0.5688197612762451}, {'word': 'Database', 'score': 0.8110573291778564}, {'word': 'Chemas', 'score': 0.5512516498565674}, {'word': 'Que', 'score': 0.7749623656272888}, {'word': 'Name City', 'score': 0.8222974538803101}, {'word': 'High', 'score': 0.7270482182502747}, {'word': 'Frequency Trading Matching', 'score': 0.8281161189079285}, {'word': 'C + +', 'score': 0.78647381067276}, {'word': 'Python', 'score': 0.7329490780830383}, {'word': 'ETL Pipeline', 'score': 0.9034730792045593}, {'word': 'Regulatory Data', 'score': 0.7138006687164307}, {'word': 'Mifid II', 'score': 0.7319916486740112}, {'word': 'Spark', 'score': 0.7288634777069092}, {'word': 'Filing', 'score': 0.6241484880447388}, {'word': 'Education', 'score': 0.9542480707168579}, {'word': 'Science', 'score': 0.6737659573554993}, {'word': 'Computer Science', 'score': 0.7394609451293945}, {'word': 'State University Skills', 'score': 0.8130306601524353}, {'word': 'Software Engineer', 'score': 0.7727030515670776}, {'word': 'Java', 'score': 0.8601884841918945}, {'word': 'Boot', 'score': 0.9438155889511108}, {'word': 'React', 'score': 0.7376425862312317}, {'word': 'Stack', 'score': 0.8775767087936401}, {'word': 'Microservice', 'score': 0.8665919303894043}, {'word': 'Fintech', 'score': 0.5899511575698853}, {'word': 'Pay', 'score': 0.9849514365196228}, {'word': 'Low', 'score': 0.8595581650733948}, {'word': 'Ncy', 'score': 0.6660072207450867}, {'word': 'SQL', 'score': 0.6758235692977905}, {'word': 'Dock', 'score': 0.7315143942832947}, {'word': 'Kubernet', 'score': 0.8971368670463562}, {'word': 'AWS', 'score': 0.6854211091995239}, {'word': 'Python', 'score': 0.6044491529464722}, {'word': 'Gile', 'score': 0.820568323135376}], 'EXP': [{'word': '7 Years', 'score': 0.9531562328338623}, {'word': '5 Million Transactions', 'score': 0.7931445240974426}, {'word': '20ms Latency', 'score': 0.5611857771873474}, {'word': 'Concurrency', 'score': 0.5762457251548767}]}"
"""FULL STACK DEVELOPER, DIGITAL BANKING Summary Dedicated Full Stack Developer with 5 years of experience building secure, customer-facing web applications for a major digital bank. Expertise in C#, .NET Core, Angular, and cloud services (Azure). Proficient in every stage of the Software Development Life Cycle (SDLC). Highlights C#, .NET Core/Framework Angular, TypeScript, HTML/CSS Web Security & Authentication (OAuth 2.0) Azure Cloud Services (App Services, Functions) SQL Server & Entity Framework Agile (Scrum) & Azure DevOps Git & Version Control Experience Full Stack Developer, Digital Banking 01/2021 to Current Company Name City , State Designed and launched the **new customer self-service portal** using **C#/.NET Core (API)** and **Angular (Front-End)**, increasing digital service adoption by 30%. Implemented **OAuth 2.0 and OpenID Connect** for secure customer authentication and authorization. Utilized **Azure DevOps (Pipelines)** to manage automated build, test, and deployment into **Azure App Services**. Developed complex stored procedures and utilized Entity Framework for data access on **SQL Server**. Collaborated with UX/UI designers and product owners in a daily Scrum environment. Mid-Level Developer 07/2017 to 12/2020 Company Name City , State Contributed to the back-end development of the internal loan origination system using C#/.NET Framework. Integrated internal services using SOAP and REST protocols. Fixed critical bugs and performed performance optimizations on legacy codebases. Developed reports for the Operations team using SSRS (SQL Server Reporting Services). Education Bachelor of Science : Software Engineering 2017 State University Skills Full Stack Developer, C#, .NET Core, Angular, Digital Banking, Web Security, Azure, SQL Server, Entity Framework, Agile, Azure DevOps, Software Engineering""",{'fullContent': '...'},"{'SKILL': [{'word': 'DIGITAL', 'score': 0.6746669411659241}, {'word': 'ING Summa', 'score': 0.8009464740753174}, {'word': 'Full Stack Developer', 'score': 0.96795254945755}, {'word': 'Secure', 'score': 0.7240557074546814}, {'word': '. NET Core', 'score': 0.8318084478378296}, {'word': 'Angular', 'score': 0.8881286382675171}, {'word': 'Software Development Life Cycle', 'score': 0.9906443357467651}, {'word': 'SDLC', 'score': 0.7408387660980225}, {'word': '. NET Core', 'score': 0.8433725237846375}, {'word': 'Framework Angular', 'score': 0.864213764667511}, {'word': 'Typescript', 'score': 0.9762452840805054}, {'word': 'CSS Web Security', 'score': 0.902246356010437}, {'word': 'Authentication', 'score': 0.8876017332077026}, {'word': 'Oauth 2', 'score': 0.7857903242111206}, {'word': 'Azure Cloud Services', 'score': 0.8659311532974243}, {'word': 'App Services', 'score': 0.9502766728401184}, {'word': 'Functions', 'score': 0.9714235067367554}, {'word': 'SQL Server', 'score': 0.9633261561393738}, {'word': 'Ty Framework Agile Scrum', 'score': 0.9502049684524536}, {'word': 'Zure Devops Git', 'score': 0.9037147164344788}, {'word': 'Version Control', 'score': 0.9311381578445435}, {'word': 'Stack Develo', 'score': 0.9385294914245605}, {'word': 'Digital Banking', 'score': 0.9825553894042969}, {'word': 'Name City', 'score': 0.7955386638641357}, {'word': 'Customer', 'score': 0.6109820604324341}, {'word': '. NET Core API', 'score': 0.662355899810791}, {'word': 'Angular', 'score': 0.7597339153289795}, {'word': 'Front - End', 'score': 0.8585894703865051}, {'word': 'Oauth 2', 'score': 0.9484432935714722}, {'word': 'Openid Connect', 'score': 0.7656382918357849}, {'word': 'Devops Pipelines', 'score': 0.8974725604057312}, {'word': 'Zure App Services', 'score': 0.7740824818611145}, {'word': 'Ty Framework', 'score': 0.8778850436210632}, {'word': 'SQL Server', 'score': 0.7779375910758972}, {'word': 'UI Designers', 'score': 0.9642407298088074}, {'word': 'Scrum Environment', 'score': 0.920804500579834}, {'word': 'Level Develo', 'score': 0.7680382132530212}, {'word': 'Company Name City', 'score': 0.7824090123176575}, {'word': 'Back', 'score': 0.5656403303146362}, {'word': 'End', 'score': 0.817342221736908}, {'word': 'Loan Origination', 'score': 0.9571875929832458}, {'word': 'NET Framework', 'score': 0.9127913117408752}, {'word': 'SOAP', 'score': 0.9367792010307312}, {'word': 'Fixed', 'score': 0.9597825407981873}, {'word': 'Bases', 'score': 0.8727294206619263}, {'word': 'Develo', 'score': 0.9455241560935974}, {'word': 'Operations', 'score': 0.9933737516403198}, {'word': 'SSRS', 'score': 0.8827549815177917}, {'word': 'SQL Server Report', 'score': 0.9185324907302856}, {'word': 'Services', 'score': 0.9942386150360107}, {'word': 'Education', 'score': 0.9938150644302368}, {'word': 'Software Engineering', 'score': 0.9590566158294678}, {'word': 'State University Skills', 'score': 0.927435576915741}, {'word': 'Stack Develo', 'score': 0.8960722088813782}, {'word': 'NET', 'score': 0.7690564393997192}, {'word': 'Core', 'score': 0.9078165292739868}, {'word': 'Angular', 'score': 0.9592519998550415}, {'word': 'Digital', 'score': 0.893554151058197}, {'word': 'Web Security', 'score': 0.8764365911483765}, {'word': 'Azure', 'score': 0.924252986907959}, {'word': 'SQL Server', 'score': 0.9214160442352295}, {'word': 'Framework', 'score': 0.9902430176734924}, {'word': 'Agile', 'score': 0.9100704193115234}, {'word': 'Azure Devops', 'score': 0.9104612469673157}, {'word': 'Software Engineering', 'score': 0.9179867506027222}], 'EXP': [{'word': '5 Years', 'score': 0.9795506000518799}, {'word': 'Service Adoption', 'score': 0.8660788536071777}, {'word': 'Authentic', 'score': 0.7326955199241638}, {'word': 'Deployment', 'score': 0.7737520933151245}]}"
"""CLOUD ARCHITECT, INFRASTRUCTURE Summary Certified Cloud Architect with 12 years of experience (5 in Cloud) designing and governing scalable, resilient, and secure infrastructure platforms (AWS, VMware) for financial institutions. Expertise in networking, high availability, migration strategies, and Infrastructure as Code (IaC). Highlights Cloud Architecture (AWS, Azure) Virtualization (VMware) & Data Centers Networking (VPC, Direct Connect, Firewalls) Infrastructure as Code (Terraform, CloudFormation) Migration Strategies & DR High Availability & Resilience IT Governance & Security Experience Cloud Architect, Infrastructure 01/2020 to Current Company Name City , State Led the architecture and execution of the **bank's hybrid cloud strategy**, migrating 40% of the core applications to **AWS**. Designed the **secure network topology (VPC segmentation)** and connectivity (**Direct Connect**) between on-premise data centers and the cloud. Developed and governed **Infrastructure as Code (Terraform)** modules used by DevOps teams to ensure automated compliance and consistency. Defined and tested the **Disaster Recovery (DR) plan** leveraging AWS multi-region capabilities, reducing RTO from 24 hours to 4 hours. Partnered with Cybersecurity to implement key security controls (WAF, GuardDuty, KMS). Infrastructure Engineer 06/2016 to 12/2019 Company Name City , State Managed and maintained the enterprise **VMware virtualization environment** (500+ virtual machines). Performed capacity planning and procurement for on-premise servers and storage. Automated routine maintenance and deployment tasks using PowerShell and Python scripts. Managed Cisco networking equipment and firewall policies (Cisco ASA). Education Master of Science : Information Technology 2016 State University AWS Certified Solutions Architect - Professional (2020) Skills Cloud Architect, AWS, Azure, Hybrid Cloud, Infrastructure, VMware, Networking, Terraform, IaC, Disaster Recovery, IT Governance, Cisco, Security, Financial Technology""",{'fullContent': '...'},"{'TOOL': [{'word': 'AWS', 'score': 0.7377268075942993}, {'word': 'Terraform', 'score': 0.7914700508117676}, {'word': 'WAF', 'score': 0.63179612159729}, {'word': 'Guardduty', 'score': 0.7321817874908447}, {'word': 'KMS', 'score': 0.6287916898727417}], 'SKILL': [{'word': 'Cloud Architect', 'score': 0.9752942323684692}, {'word': 'Lient', 'score': 0.5881425738334656}, {'word': 'Secure Infrastructure Platforms', 'score': 0.7212284207344055}, {'word': 'AWS', 'score': 0.8148501515388489}, {'word': 'Vmware', 'score': 0.955557107925415}, {'word': 'Financial Institutions', 'score': 0.99013352394104}, {'word': 'Networking', 'score': 0.6059529781341553}, {'word': 'High Availability', 'score': 0.8230355978012085}, {'word': 'Infrastructure As Code', 'score': 0.9878876209259033}, {'word': 'Iac', 'score': 0.5551092624664307}, {'word': 'Cloud Architecture', 'score': 0.9941970109939575}, {'word': 'AWS', 'score': 0.812380850315094}, {'word': 'Virtualization', 'score': 0.9669481515884399}, {'word': 'Vmware', 'score': 0.9669008851051331}, {'word': 'Data Centers Networking', 'score': 0.9886205196380615}, {'word': 'VPC', 'score': 0.8469710946083069}, {'word': 'Direct Connect', 'score': 0.9031590819358826}, {'word': 'Firewalls', 'score': 0.736041247844696}, {'word': 'Infrastructure As Code', 'score': 0.9267601370811462}, {'word': 'Formation', 'score': 0.8394694328308105}, {'word': 'Migration Strategies', 'score': 0.8644804954528809}, {'word': 'DR High Availability', 'score': 0.8803016543388367}, {'word': 'Resilience IT Governance', 'score': 0.9391670823097229}, {'word': 'Security', 'score': 0.9894830584526062}, {'word': 'Cloud Architect', 'score': 0.8218955993652344}, {'word': 'Secure Network Topology', 'score': 0.7134501338005066}, {'word': 'VPC Segmentation', 'score': 0.8979670405387878}, {'word': 'Direct Connect', 'score': 0.9707961678504944}, {'word': 'Centers', 'score': 0.6643674969673157}, {'word': 'Infrastructure As Code', 'score': 0.9068849086761475}, {'word': 'Devops', 'score': 0.8339343070983887}, {'word': 'Disaster Recovery', 'score': 0.854375422000885}, {'word': 'Bersecurity', 'score': 0.9738614559173584}, {'word': 'Infrastructure Engineer', 'score': 0.95833420753479}, {'word': 'Enterprise', 'score': 0.6977576613426208}, {'word': 'Vmware Virtualization', 'score': 0.840715765953064}, {'word': 'Capacity Planning', 'score': 0.6306203603744507}, {'word': 'Power', 'score': 0.7849704027175903}, {'word': 'Hell', 'score': 0.5712777972221375}, {'word': 'Man', 'score': 0.679363489151001}, {'word': 'Wall', 'score': 0.7002963423728943}, {'word': 'Education', 'score': 0.9526904225349426}, {'word': 'Information Technology', 'score': 0.5550969243049622}, {'word': 'Solutions Architect', 'score': 0.9389766454696655}, {'word': 'Infrastructure', 'score': 0.7409688830375671}, {'word': 'Vmware', 'score': 0.5729389786720276}, {'word': 'Networking', 'score': 0.5638167858123779}, {'word': 'Disaster Recovery', 'score': 0.6800676584243774}, {'word': 'Governance', 'score': 0.7667129039764404}, {'word': 'Financial Technology', 'score': 0.9324634075164795}], 'EXP': [{'word': '12 Years', 'score': 0.9098258018493652}, {'word': 'Region', 'score': 0.6316720843315125}, {'word': '24 Hours', 'score': 0.9414067268371582}, {'word': '4 Hours', 'score': 0.9838707447052002}, {'word': 'Security', 'score': 0.7541595101356506}, {'word': 'Curement', 'score': 0.6278095841407776}]}"
"""CYBER DEFENSE ANALYST, TRADING SYSTEMS Summary Experienced Cyber Defense Analyst with 6 years of expertise in threat hunting, security monitoring, and incident response specific to financial trading and payments systems. Expertise in SIEM (Splunk), EDR tools, and mitigating advanced persistent threats (APTs). Highlights Threat Hunting & Forensics SIEM (Splunk) & Log Analysis Incident Response (IR) Financial Fraud & APT Mitigation Endpoint Detection & Response (EDR) Regulatory Compliance (NYDFS, FINRA) Shell Scripting & Automation Experience Cyber Defense Analyst, Trading Systems 03/2020 to Current Company Name City , State Led **threat hunting operations** across the trading environment, utilizing **Splunk ES** to proactively search for indicators of compromise (IOCs) overlooked by automated alerts. Served as the **incident commander** for critical security events (e.g., zero-day exploitation, ransomware), coordinating response and containment across technical teams. Developed custom **Splunk alerts and dashboards** tailored to detect suspicious activity in proprietary trading applications and payments platforms. Managed the firm's **EDR (Endpoint Detection and Response) platform**, ensuring optimal configuration and rapid response capability. Ensured compliance with **NYDFS Cybersecurity Regulations** and performed security reviews for new trading software. SOC Analyst II 07/2017 to 02/2020 Company Name City , State Performed continuous monitoring and analysis of security alerts (Tier 2/3) for core banking systems. Triaged and investigated potential phishing, malware, and unauthorized access attempts. Wrote and maintained **Shell and Python scripts** to automate forensic data collection. Managed all security incidents in accordance with established ITIL incident management processes. Education Bachelor of Science : Cybersecurity 2017 State University GIAC Certified Forensic Analyst (GCFA) (2021) Skills Cyber Defense, Threat Hunting, Splunk, SIEM, Incident Response, Trading Systems, Financial Fraud, APT, EDR, FINRA, NYDFS, Python, Cybersecurity, Technology""",{'fullContent': '...'},"{'TOOL': [{'word': 'Splunk ES', 'score': 0.6085377931594849}, {'word': 'Splunk', 'score': 0.5519853830337524}, {'word': 'Shell', 'score': 0.5876771211624146}], 'SKILL': [{'word': 'Ber Defense Analyst', 'score': 0.8901058435440063}, {'word': 'Threat Hunting', 'score': 0.9140024781227112}, {'word': 'Security Monitoring', 'score': 0.9091789126396179}, {'word': 'Incident Response', 'score': 0.7641309499740601}, {'word': 'Financial Trading', 'score': 0.9932806491851807}, {'word': 'Payments Systems', 'score': 0.8568530082702637}, {'word': 'Persistent Threats', 'score': 0.9686939716339111}, {'word': 'Apts', 'score': 0.6892456412315369}, {'word': 'Eat Hunting', 'score': 0.9772117733955383}, {'word': 'For', 'score': 0.8372287750244141}, {'word': 'Ensics SIEM', 'score': 0.6850484609603882}, {'word': 'G Analysis', 'score': 0.9262589812278748}, {'word': 'Response', 'score': 0.9121692776679993}, {'word': 'Financial Fraud', 'score': 0.9874921441078186}, {'word': 'APT Mi', 'score': 0.8055331110954285}, {'word': 'Gation Endpoint Detection', 'score': 0.9419757723808289}, {'word': 'Response', 'score': 0.939060628414154}, {'word': 'Reg', 'score': 0.5930932760238647}, {'word': 'Ulatory Compliance', 'score': 0.9583028554916382}, {'word': 'Shell Scripting', 'score': 0.7226514220237732}, {'word': 'Automation', 'score': 0.948754072189331}, {'word': 'Threat Hunting', 'score': 0.8644866943359375}, {'word': 'Trading', 'score': 0.8829614520072937}, {'word': 'IOC', 'score': 0.5628515481948853}, {'word': 'Zero - Day Exploitation', 'score': 0.6742904186248779}, {'word': 'Ransomware', 'score': 0.8891454935073853}, {'word': 'Alert', 'score': 0.6685419082641602}, {'word': 'Endpoint Detection', 'score': 0.9296770095825195}, {'word': 'Response', 'score': 0.9736195802688599}, {'word': 'Bersecurity Regulations', 'score': 0.5773530006408691}, {'word': 'Security Reviews', 'score': 0.728307843208313}, {'word': 'Trading', 'score': 0.9262567162513733}, {'word': 'Security', 'score': 0.5650561451911926}, {'word': 'Financial', 'score': 0.8345127105712891}], 'EXP': [{'word': '6 Years', 'score': 0.9377313852310181}, {'word': 'Response', 'score': 0.6620743870735168}]}"
