text,meta,extracted_entities
"""IT AUDITOR, REGULATORY COMPLIANCE Summary CPA and CISA certified IT Auditor with 8 years of experience leading technology and integrated audits focused on regulatory compliance (SOX, SOC, FFIEC) within a major bank. Expertise in assessing IT General Controls (ITGCs), application controls, and identifying risks in complex IT environments. Highlights IT Audit & Integrated Audits IT General Controls (ITGCs) Regulatory Compliance (SOX, FFIEC, GLBA) CISA & CPA Certified Risk Assessment & Control Testing IT Governance & Policy Operating Systems (Windows, Unix, Mainframe) Experience IT Audit Manager 01/2020 to Current Company Name City , State Led the **annual planning and execution of integrated audits** for core financial applications and trading platforms. Oversaw the **SOX 404 compliance testing** for IT General Controls (ITGCs), including access management, change management, and security operations. Performed risk-based audits related to **FFIEC and GLBA regulatory requirements** for data privacy and security. Managed a team of 4 auditors, including coaching on control testing and report writing using **TeamMate**. Presented audit findings and remediation plans to senior management and the Audit Committee. Developed and implemented new **IT governance policies** regarding cloud usage and third-party vendor risk. Senior IT Auditor 06/2017 to 12/2019 Company Name City , State Performed **pre-implementation reviews** for major system upgrades and platform migrations, ensuring controls were embedded by design. Tested **application controls (manual and automated)** for retail and commercial lending systems. Documented and evaluated the design effectiveness of controls across various operating systems (**Windows, Unix, Mainframe**). Assisted in the preparation of **SOC 1 and SOC 2 reports**. Education Master of Business Administration : Finance 2017 State University CPA (2018), CISA (2019) Skills IT Audit, Integrated Audit, SOX, ITGC, FFIEC, Regulatory Compliance, CISA, CPA, Risk Assessment, Control Testing, IT Governance, TeamMate, Financial Services, Mainframe, Audit Management""",{'fullContent': '...'},"{'SKILL': [{'word': 'CPA', 'score': 0.8286932706832886}, {'word': 'IT Auditor', 'score': 0.9706291556358337}, {'word': 'Audit', 'score': 0.6677489280700684}, {'word': 'Regulatory Compliance', 'score': 0.9724447131156921}, {'word': 'IT General Controls', 'score': 0.9372408986091614}, {'word': 'ITGC', 'score': 0.6224006414413452}, {'word': 'Risks', 'score': 0.6400753259658813}, {'word': 'IT Environments', 'score': 0.7275762557983398}, {'word': 'IT Audit', 'score': 0.9738032817840576}, {'word': 'Audits', 'score': 0.8667710423469543}, {'word': 'General Controls', 'score': 0.8258797526359558}, {'word': 'Reg', 'score': 0.9491147994995117}, {'word': 'Ulatory Compliance', 'score': 0.9843251705169678}, {'word': 'CISA', 'score': 0.6808210015296936}, {'word': 'Risk Assessment', 'score': 0.8511375188827515}, {'word': 'Control Testing', 'score': 0.896802544593811}, {'word': 'Governance', 'score': 0.9824097752571106}, {'word': 'Policy Operating', 'score': 0.9567177891731262}, {'word': 'IT Audit Manager', 'score': 0.9841433763504028}, {'word': 'Financial Applications', 'score': 0.9820095300674438}, {'word': 'Trading', 'score': 0.5872170925140381}, {'word': 'IT General Controls', 'score': 0.9138327836990356}, {'word': 'Access Management', 'score': 0.8579766750335693}, {'word': 'Change Management', 'score': 0.9246687889099121}, {'word': 'Security Operations', 'score': 0.8594394326210022}, {'word': 'Risk', 'score': 0.9801760315895081}, {'word': 'Audit', 'score': 0.9149826765060425}, {'word': 'Regulatory Requirements', 'score': 0.7903258204460144}, {'word': 'Security', 'score': 0.5679162740707397}, {'word': 'Control Testing', 'score': 0.9182522892951965}, {'word': 'Audi', 'score': 0.7285354733467102}, {'word': 'Committee', 'score': 0.7129161953926086}, {'word': 'IT Governance', 'score': 0.6587781310081482}, {'word': 'IT Audi', 'score': 0.9154539704322815}, {'word': 'Application Controls', 'score': 0.5621305108070374}, {'word': 'Retail', 'score': 0.8949664235115051}, {'word': 'Commercial Lending', 'score': 0.7711344957351685}, {'word': 'Risk Assessment', 'score': 0.6492538452148438}, {'word': 'Financial Services', 'score': 0.6985999345779419}, {'word': 'Management', 'score': 0.6065136194229126}], 'TOOL': [{'word': 'SOX', 'score': 0.6465746164321899}, {'word': 'SOC', 'score': 0.58472740650177}, {'word': 'FFIEC', 'score': 0.5660523772239685}, {'word': 'SOX', 'score': 0.7410807013511658}, {'word': 'FFIEC', 'score': 0.6901214122772217}, {'word': 'GLBA', 'score': 0.6072896718978882}, {'word': 'Windows', 'score': 0.6990774273872375}, {'word': 'Unix', 'score': 0.6221834421157837}, {'word': 'Mainframe', 'score': 0.7092993855476379}, {'word': 'Teammate', 'score': 0.7016691565513611}], 'EXP': [{'word': '8 Years', 'score': 0.9109629392623901}, {'word': 'Cloud Usage', 'score': 0.8094090223312378}, {'word': 'Party Vendor Risk', 'score': 0.684495210647583}]}"
"""DATABASE ADMINISTRATOR (DBA), ORACLE/SQL Summary Expert Oracle and SQL Server Database Administrator with 9 years of experience managing, tuning, and securing high-volume transactional databases for core banking systems. Expertise in performance optimization, disaster recovery, and ensuring 24/7 database availability. Highlights Oracle & SQL Server Administration Performance Tuning & Optimization Disaster Recovery (DR) & Backup High Availability (HA) (RAC, AlwaysOn) SQL, PL/SQL, T-SQL Database Security & Patching Monitoring & Alerting (OEM, Splunk) Experience Oracle/SQL Server DBA 01/2019 to Current Company Name City , State Managed a database footprint of 50+ servers (Oracle/SQL Server) supporting high-volume **online and mobile banking applications**, ensuring **99.99% uptime**. Led the implementation of **Oracle RAC and SQL Server AlwaysOn** clusters for enhanced high availability (HA) and disaster recovery (DR). Performed extensive **database performance tuning** (indexing, query optimization, resource allocation), which improved transaction processing speed by 20%. Developed and automated backup and recovery procedures, reducing RTO for critical systems to under 1 hour. Enforced strict **database security protocols** (encryption, access control) and managed regular patching and version upgrades. Utilized **Oracle Enterprise Manager (OEM)** and **Splunk** for proactive monitoring and alerting. Junior/Mid-Level DBA 06/2016 to 12/2018 Company Name City , State Administered day-to-day database maintenance tasks, including user creation, space management, and troubleshooting connectivity issues. Wrote and maintained **PL/SQL and T-SQL scripts** for routine maintenance and reporting. Assisted in the execution of database schema changes requested by application development teams. Monitored batch jobs and ETL processes, addressing failures in a timely manner. Education Bachelor of Science : Information Systems 2016 State University Oracle Certified Professional (OCP) (2019) Skills DBA, Oracle, SQL Server, Database Administration, Performance Tuning, Disaster Recovery, High Availability, RAC, AlwaysOn, SQL, PL/SQL, Database Security, OEM, Financial Technology, Uptime""",{'fullContent': '...'},"{'SKILL': [{'word': 'DBA', 'score': 0.6351124048233032}, {'word': 'ORACLE', 'score': 0.8197392821311951}, {'word': 'SQL Summary Ex', 'score': 0.8793706893920898}, {'word': 'Oracle', 'score': 0.7504093647003174}, {'word': 'SQL Server Database Administrator', 'score': 0.8752549886703491}, {'word': 'Transactional Databases', 'score': 0.7380514740943909}, {'word': 'Banking Systems', 'score': 0.6210659742355347}, {'word': 'Optimization', 'score': 0.8700782656669617}, {'word': 'Disaster Recovery', 'score': 0.6817370653152466}, {'word': 'Database Availability', 'score': 0.6823868155479431}, {'word': 'Oracle', 'score': 0.9707749485969543}, {'word': 'QL Server Administration Performance Tuning', 'score': 0.8360750079154968}, {'word': 'Optimization Disaster Recovery', 'score': 0.8237269520759583}, {'word': 'Backup High Availability', 'score': 0.9016889929771423}, {'word': 'SQL', 'score': 0.7036572694778442}, {'word': 'QL Database Security', 'score': 0.8860657215118408}, {'word': 'Patching Monitoring', 'score': 0.9837874174118042}, {'word': 'Alerting', 'score': 0.9735694527626038}, {'word': 'Oracle', 'score': 0.8023992776870728}, {'word': 'QL Server', 'score': 0.8822042942047119}, {'word': 'Mobile Banking Applications', 'score': 0.7515862584114075}, {'word': 'SQL Server', 'score': 0.5702820420265198}, {'word': 'High', 'score': 0.6214854121208191}, {'word': 'Recovery', 'score': 0.9352506399154663}, {'word': 'Database', 'score': 0.5818671584129333}, {'word': 'Indexing', 'score': 0.6753100156784058}, {'word': 'Query Optimization', 'score': 0.6988397240638733}, {'word': 'Resource Allocation', 'score': 0.7930643558502197}, {'word': 'Transaction Processing', 'score': 0.5685019493103027}, {'word': 'Database Security', 'score': 0.7688706517219543}, {'word': 'Encryption', 'score': 0.6625921726226807}, {'word': 'Access Control', 'score': 0.6902447938919067}, {'word': 'Oracle Enterprise Manager', 'score': 0.9240738749504089}, {'word': 'Database Maintenance', 'score': 0.7691389322280884}, {'word': 'Monitor', 'score': 0.9252613186836243}, {'word': 'QL Server', 'score': 0.5757980346679688}, {'word': 'Database Administration', 'score': 0.6779971718788147}, {'word': 'Recovery', 'score': 0.9279903769493103}], 'EXP': [{'word': '9 Years', 'score': 0.8829195499420166}, {'word': 'Availability', 'score': 0.6572787761688232}, {'word': 'Performance', 'score': 0.6205285787582397}, {'word': 'Backup', 'score': 0.633733868598938}, {'word': 'Recovery Procedures', 'score': 0.5604488253593445}, {'word': 'Systems', 'score': 0.5582286715507507}, {'word': '1 Hour', 'score': 0.9363349676132202}, {'word': 'Patching', 'score': 0.9089428186416626}, {'word': 'Maintenance', 'score': 0.7069896459579468}], 'TOOL': [{'word': 'RAC', 'score': 0.6111553311347961}, {'word': 'Alwayson', 'score': 0.6904712319374084}, {'word': 'Splunk', 'score': 0.7476881146430969}, {'word': 'Oracle RAC', 'score': 0.8335892558097839}, {'word': 'Alwayson', 'score': 0.7430365085601807}, {'word': 'Splunk', 'score': 0.7088614106178284}]}"
"""UX/UI DESIGNER, MOBILE BANKING Summary Creative and user-centric UX/UI Designer with 6 years of experience specializing in mobile and online banking platforms. Proven ability to conduct user research, create wireframes/prototypes, and drive design solutions that enhance usability and customer satisfaction. Highlights UX/UI Design (Mobile/Web) User Research & Usability Testing Wireframing & Prototyping (Figma, Sketch) Design Systems & Guidelines Agile (Scrum) Collaboration Mobile Banking & Financial Apps A/B Testing & Analytics Experience UX/UI Designer, Mobile Banking 01/2020 to Current Company Name City , State Led the **end-to-end UX/UI design** for the bank's award-winning mobile application, focusing on the simplification of complex features like **loan application and wire transfers**. Conducted **user research** (interviews, surveys, usability testing) to identify pain points, resulting in a **25% improvement in task completion rate**. Created and maintained the bank's centralized **design system (Figma)**, ensuring consistency across all digital channels. Developed **high-fidelity prototypes (Figma)** for new features and presented design concepts to product managers and stakeholders. Collaborated closely with Agile development teams to ensure technical feasibility and successful implementation of design specifications. Designed and analyzed **A/B tests** for key conversion flows to continuously optimize the user experience. UI Designer 06/2017 to 12/2019 Company Name City , State Responsible for the visual design of online banking portals, ensuring brand consistency and accessibility standards. Created wireframes and mockups using **Sketch and InVision**. Worked with front-end developers to refine CSS/HTML implementation and resolved visual bugs. Maintained a library of visual assets and design components. Education Bachelor of Arts : Graphic Design 2017 State University Certificate in UX Design (2018) Skills UX/UI Design, Mobile Banking, Web Design, User Research, Prototyping, Wireframing, Figma, Sketch, Design Systems, Agile, Scrum, A/B Testing, Financial Apps, Customer Satisfaction""",{'fullContent': '...'},"{'SKILL': [{'word': 'UX / UI DESI', 'score': 0.5999665260314941}, {'word': 'Summa', 'score': 0.5530756711959839}, {'word': 'I Designer', 'score': 0.915488064289093}, {'word': 'Online Banking Platforms', 'score': 0.5911188125610352}, {'word': 'Research', 'score': 0.8464896082878113}, {'word': 'Wireframe', 'score': 0.7153239250183105}, {'word': 'UI Design', 'score': 0.9274030327796936}, {'word': 'Mobile', 'score': 0.9590689539909363}, {'word': 'Web', 'score': 0.5601295232772827}, {'word': 'Research', 'score': 0.9887844324111938}, {'word': 'Usability Testing', 'score': 0.9349736571311951}, {'word': 'Wireframing', 'score': 0.8704436421394348}, {'word': 'Prototyping', 'score': 0.934112548828125}, {'word': 'Design Systems', 'score': 0.7350605726242065}, {'word': 'Guide', 'score': 0.9597256779670715}, {'word': 'Scrum', 'score': 0.8568781614303589}, {'word': 'Bor', 'score': 0.5776301026344299}, {'word': 'Mobile Banking', 'score': 0.9893401861190796}, {'word': 'Financial Apps A', 'score': 0.9040195941925049}, {'word': 'B Testing', 'score': 0.962781548500061}, {'word': 'Analytics', 'score': 0.9631004929542542}, {'word': 'UI Designer', 'score': 0.8359494805335999}, {'word': 'Mobile Banking', 'score': 0.9881024956703186}, {'word': 'End UX', 'score': 0.5761949419975281}, {'word': 'UI Design', 'score': 0.7755546569824219}, {'word': 'Bank', 'score': 0.5780916213989258}, {'word': 'Loan Application', 'score': 0.7276611924171448}, {'word': 'Wire Transfers', 'score': 0.901893675327301}, {'word': 'Research', 'score': 0.746233344078064}, {'word': 'Testing', 'score': 0.9012784957885742}, {'word': 'Gile Development', 'score': 0.8353415131568909}, {'word': 'B Tests', 'score': 0.6251068711280823}, {'word': 'I Designer', 'score': 0.9276615381240845}, {'word': 'Banking Portal', 'score': 0.9231225252151489}, {'word': 'Fine', 'score': 0.7776976823806763}, {'word': 'Main', 'score': 0.5603113174438477}, {'word': 'Assets', 'score': 0.7518904805183411}, {'word': 'Education', 'score': 0.980627715587616}, {'word': 'Graphic Design', 'score': 0.8066405057907104}, {'word': 'Design', 'score': 0.9782751798629761}, {'word': 'Skills U', 'score': 0.643394410610199}, {'word': 'Design', 'score': 0.9618156552314758}, {'word': 'Mobile Banking', 'score': 0.6170029640197754}, {'word': 'Design', 'score': 0.9829295873641968}, {'word': 'Research', 'score': 0.9722984433174133}, {'word': 'Design Systems', 'score': 0.694848358631134}, {'word': 'Scrum', 'score': 0.6153176426887512}, {'word': 'Testing', 'score': 0.9801270961761475}, {'word': 'Financial', 'score': 0.970054030418396}, {'word': 'Custom', 'score': 0.6471251845359802}], 'TOOL': [{'word': 'Figma', 'score': 0.6108000874519348}, {'word': 'Sket', 'score': 0.553251326084137}, {'word': 'Figma', 'score': 0.7229438424110413}, {'word': 'Figma', 'score': 0.6365578174591064}, {'word': 'Frame', 'score': 0.6642822027206421}, {'word': 'CSS', 'score': 0.583156406879425}], 'EXP': [{'word': '6 Years', 'score': 0.9346388578414917}, {'word': 'Satisfaction', 'score': 0.5980848073959351}, {'word': 'Completion', 'score': 0.8602436780929565}]}"
"""TECHNICAL WRITER, API DOCUMENTATION Summary Dedicated Technical Writer with 5 years of experience specializing in developing and managing technical documentation for developer APIs and complex financial systems. Proven ability to translate complex technical concepts into clear, concise, and user-friendly materials for diverse audiences. Highlights API Documentation (Swagger/OpenAPI) Financial Systems & Developer Portals Technical Writing & Editing Tools (MadCap Flare, Confluence) Content Management Systems (CMS) Agile (Scrum) Collaboration DITA/XML Structured Authoring Experience Technical Writer, API Documentation 03/2021 to Current Company Name City , State Led the creation and maintenance of **external-facing API documentation (Swagger/OpenAPI)** for the new Fintech partner platform, facilitating faster developer integration. Wrote clear and comprehensive documentation for core banking functions, including wire transfer protocols and KYC verification procedures. Managed the organization and version control of all technical content within **Confluence and MadCap Flare**. Collaborated directly with **Software Engineers and Product Managers** in daily Scrum meetings to ensure documentation aligned with product releases. Implemented a **DITA/XML structured authoring environment** to enhance content reuse and translation efficiency. Developed tutorials, quick-start guides, and sample code snippets for developer onboarding. Technical Content Specialist 07/2018 to 02/2021 Company Name City , State Produced user manuals and system guides for internal financial reporting software. Edited and proofread technical specifications, ensuring accuracy, consistency, and adherence to company style guides. Managed the content migration from an outdated system to a new **CMS (Content Management System)**. Created instructional flowcharts and diagrams (**Visio**) to explain complex system workflows. Education Bachelor of Arts : English/Technical Communication 2018 State University Skills Technical Writer, API Documentation, Swagger, OpenAPI, Confluence, MadCap Flare, DITA, XML, Financial Systems, Developer Portal, Agile, Scrum, Technical Communication, Content Management, Software Engineering""",{'fullContent': '...'},"{'TOOL': [{'word': 'Swagger', 'score': 0.8289958834648132}, {'word': 'Openapi', 'score': 0.8296279907226562}, {'word': 'Madcap Flar', 'score': 0.7403327822685242}, {'word': 'Swagger', 'score': 0.8960215449333191}, {'word': 'Openapi', 'score': 0.7498425841331482}, {'word': 'Tech', 'score': 0.6121523976325989}, {'word': 'Confluence', 'score': 0.6064221262931824}, {'word': 'Madcap Flare', 'score': 0.7632127404212952}], 'SKILL': [{'word': 'API', 'score': 0.6375312805175781}, {'word': 'Technical Writer', 'score': 0.9572442173957825}, {'word': 'Technical Documentation', 'score': 0.68363356590271}, {'word': 'Financial Systems', 'score': 0.9870040416717529}, {'word': 'Technical Concepts', 'score': 0.8106502294540405}, {'word': 'Documentation', 'score': 0.9368267059326172}, {'word': 'Financial Systems', 'score': 0.9950798749923706}, {'word': 'Developer Portal', 'score': 0.9619080424308777}, {'word': 'Writing', 'score': 0.9849472045898438}, {'word': 'Editing Too', 'score': 0.7167767286300659}, {'word': 'Content Management Systems', 'score': 0.9783368110656738}, {'word': 'CMS', 'score': 0.7120506167411804}, {'word': 'Gile Scrum', 'score': 0.8343997001647949}, {'word': 'DITA', 'score': 0.5597892999649048}, {'word': 'XML Structured Authoring', 'score': 0.8988683819770813}, {'word': 'Fin', 'score': 0.7458628416061401}, {'word': 'Banking Functions', 'score': 0.9702895879745483}, {'word': 'Wire Transfer Protocols', 'score': 0.9018182754516602}, {'word': 'C Verification', 'score': 0.8129240870475769}, {'word': 'Software Engineers', 'score': 0.9140045642852783}, {'word': 'Product Manager', 'score': 0.9743188619613647}, {'word': 'Scrum Meetings', 'score': 0.7349922060966492}, {'word': 'Content Specialist', 'score': 0.7969192266464233}, {'word': 'Financial Reporting', 'score': 0.9943214058876038}, {'word': 'Specifications', 'score': 0.7187500596046448}, {'word': 'Content Management', 'score': 0.6521254777908325}, {'word': 'Flow', 'score': 0.6667894721031189}, {'word': 'Education', 'score': 0.8806385397911072}, {'word': 'Communication', 'score': 0.6266081929206848}, {'word': 'Docume', 'score': 0.6483992338180542}, {'word': 'Financial Systems', 'score': 0.6721906065940857}, {'word': 'Develo', 'score': 0.6055448055267334}, {'word': 'Communication', 'score': 0.641250729560852}, {'word': 'Software Engineering', 'score': 0.7750324010848999}], 'EXP': [{'word': '5 Years', 'score': 0.9841031432151794}, {'word': 'Integration', 'score': 0.7000316977500916}, {'word': '- Start', 'score': 0.7586156129837036}]}"
"""NETWORK ENGINEER, FINANCIAL INFRASTRUCTURE Summary Certified Network Engineer with 7 years of experience in designing, implementing, and maintaining secure, high-speed network infrastructure for mission-critical financial trading and banking environments. Expertise in Cisco routing/switching, firewall management, and ensuring regulatory network compliance (PCI-DSS). Highlights Cisco Routing & Switching (CCNP, CCIE In-Progress) Firewall Management (Cisco ASA, Palo Alto) Network Security & PCI-DSS Compliance Monitoring Tools (Nagios, SolarWinds) Load Balancing (F5 LTM) Network Troubleshooting & Optimization Disaster Recovery Planning Experience Senior Network Engineer 09/2020 to Current Company Name City , State Led the **design and implementation of a redundant, low-latency network infrastructure** supporting the institutional trading floor. Managed and maintained all **Cisco routers, switches (Nexus series)**, and **Palo Alto firewalls**, ensuring optimal performance and security. Enforced strict **PCI-DSS compliance** standards across all network segments handling customer data. Responsible for **Tier 3 incident resolution** for all core network outages and connectivity issues. Configured and managed **F5 Load Balancers (LTM)** for high-traffic public-facing banking applications. Utilized **SolarWinds** for real-time monitoring, capacity planning, and traffic analysis. Network Administrator 06/2018 to 08/2020 Company Name City , State Managed the day-to-day operations of the branch office network, including VPNs, Wi-Fi, and access control. Performed routine monitoring and maintenance using **Nagios** monitoring tool. Assisted in the implementation of the network segment for the new data center migration. Developed and tested network disaster recovery procedures. Maintained network device documentation and inventory. Education Bachelor of Science : Telecommunications 2018 State University Cisco Certified Network Professional (CCNP) (2021) Skills Network Engineer, Cisco, Routing, Switching, Palo Alto, Firewall, PCI-DSS, Network Security, CCNP, SolarWinds, Nagios, Load Balancing, F5, Financial Infrastructure, Troubleshooting""",{'fullContent': '...'},"{'SKILL': [{'word': 'Network Engineer', 'score': 0.9848974943161011}, {'word': 'Speed Network Infrastructure', 'score': 0.6780784726142883}, {'word': 'Financial Trading', 'score': 0.9976441264152527}, {'word': 'Banking Environments', 'score': 0.9561981558799744}, {'word': 'Cisco Routing', 'score': 0.7534699440002441}, {'word': 'Switching', 'score': 0.9148250222206116}, {'word': 'Firewall Management', 'score': 0.9163344502449036}, {'word': 'Regulatory Network Compliance', 'score': 0.9912202954292297}, {'word': 'DSS', 'score': 0.7072513103485107}, {'word': 'Isco Routing', 'score': 0.8986709117889404}, {'word': 'Switching', 'score': 0.9933461546897888}, {'word': 'Progress', 'score': 0.7649453282356262}, {'word': 'Wall Management', 'score': 0.9885740876197815}, {'word': 'Network Security', 'score': 0.9889563322067261}, {'word': 'S Compliance Monitoring Tools', 'score': 0.9174517393112183}, {'word': 'Load Balancing', 'score': 0.8084291219711304}, {'word': 'Network Troubleshooting', 'score': 0.8796146512031555}, {'word': 'Zation', 'score': 0.9949656128883362}, {'word': 'Recovery Planning', 'score': 0.9902417659759521}, {'word': 'Network Engineer', 'score': 0.9203779697418213}, {'word': 'Low', 'score': 0.774258017539978}, {'word': 'Late', 'score': 0.5749508142471313}, {'word': 'Network', 'score': 0.9195861220359802}, {'word': 'Institutional Trading Floor', 'score': 0.7896575927734375}, {'word': 'Firewall', 'score': 0.838598370552063}, {'word': 'Lance', 'score': 0.6082260012626648}, {'word': 'Banking Applications', 'score': 0.7727993130683899}, {'word': 'Time Monitoring', 'score': 0.8570451736450195}, {'word': 'Capacity Planning', 'score': 0.8312870264053345}, {'word': 'Traffic Analysis', 'score': 0.9163893461227417}, {'word': 'Network Administrator', 'score': 0.9630496501922607}, {'word': 'Name City', 'score': 0.7261046171188354}, {'word': 'Branch', 'score': 0.613516628742218}, {'word': 'VPN', 'score': 0.8592863082885742}, {'word': 'Out', 'score': 0.5985470414161682}, {'word': 'Witch', 'score': 0.563281774520874}, {'word': 'Security', 'score': 0.6817806959152222}], 'TOOL': [{'word': 'Cisco ASA', 'score': 0.7013280391693115}, {'word': 'Nagios', 'score': 0.7689806818962097}, {'word': 'Solarwinds', 'score': 0.9290356636047363}, {'word': 'F5 LTM', 'score': 0.584717869758606}, {'word': 'Cisco Routers', 'score': 0.6812654733657837}, {'word': 'Switches', 'score': 0.7042815089225769}, {'word': 'Nexus Series', 'score': 0.5717026591300964}, {'word': 'PCI - DSS', 'score': 0.6480441689491272}, {'word': 'F5 Lo', 'score': 0.5809904932975769}, {'word': 'Solarwinds', 'score': 0.6862742900848389}, {'word': 'Fire', 'score': 0.6918020844459534}], 'EXP': [{'word': '7 Years', 'score': 0.9449253082275391}, {'word': 'Outages', 'score': 0.6401485800743103}]}"
